Reference,Reference_Alternative,Reason_for_Exclusion,Notes,Occurrences
"Shilling, A. D., Carlson, D. B., & Williams, D. E. (1999). Rainbow trout, Oncorhynchus mykiss, as a model for aromatase inhibition. The Journal of Steroid Biochemistry and Molecular Biology, 70(1-3), 89-95.",NA,Fish,NA,1
"Shine, R. (1999). Why is sex determined by nest temperature in many reptiles? Trends in Ecology & Evolution, 14(5), 186-189.",NA,No hatchling sex ratio data,NA,1
"Shine, R., & Brown, G. P. (2008). Adapting to the unpredictable: Reproductive biology of vertebrates in the Australian wet–dry tropics. Philosophical Transactions of the Royal Society B, 363(1490), 363-373.",NA,No hatchling sex ratio data,NA,2
"Shine, R., & Du, W.-G. (2018). How frequent and important is behavioral thermoregulation by embryonic reptiles? Journal of Experimental Zoology Part A, 329(4-5), 215-221.",NA,No hatchling sex ratio data,NA,2
"Shine, R., & Elphick, M. J. (2001). The effect of short-term weather fluctuations on temperatures inside lizard nests, and on the phenotypic traits of hatchling lizards. Biological Journal of the Linnean Society, 72(4), 555-565.",NA,Squamate,NA,1
"Shine, R., Warner, D. A., & Radder, R. (2007). Windows of embryonic sexual lability in two lizard species with environmental sex determination. Ecology, 88(7), 1781-1788.",NA,Squamate,NA,1
"Shoemaker, C. M., & Crews, D. (2009). Analyzing the coordinated gene network underlying temperature-dependent sex determination in reptiles. Seminars in Cell & Developmental Biology, 20(3), 293-303.",NA,No hatchling sex ratio data,NA,4
"Shoemaker-Daly, C. M., Jackson, K., Yatsu, R., Matsumoto, Y., & Crews, D. (2010). Genetic network underlying temperature-dependent sex determination is endogenously regulated by temperature in isolated cultured Trachemys scripta gonads. Developmental Dynamics, 239(4), 1061-1075.",NA,No hatchling sex ratio data,NA,3
"Sieg, A. E., Binckley, C. A., Wallace, B. P., Santidrián Tomillo, P., Reina, R. D., Paladino, F. V., & Spotila, J. R. (2011). Sex ratios of leatherback turtles: Hatchery translocation decreases metabolic heating and female bias. Endangered Species Research, 15(3), 195-204.",NA,Estimated hatchling sex ratios with temperature data,NA,2
"Sifuentes, I., Tezak, B., Wyneken, J., & Milton, S. L. (2016). Effect of incubation conditions on DNA methylation in turtles with environmental dependent sex determination. Integrative and Comparative Biology, 56, E370.",NA,No hatchling sex ratio data,NA,3
"Sifuentes-Romero, I., Merchant-Larios, H., & García-Gasca, A. (2010). Hox gene expression in the embryonic genital system of the sea turtle Lepidochelys olivacea (Eschscholt, 1829), a species with temperature-dependent sex determination. Gene Expression Patterns, 10(6), 290-298.",NA,No hatchling sex ratio data,NA,2
"Sim, E. L., Booth, D. T., Limpus, C. J., & Guinea, M. L. (2014). A comparison of hatchling locomotor performance and scute pattern variation between two rookeries of the flatback turtle (Natator depressus). Copeia, 2014(2), 339-344.",NA,No hatchling sex ratio data,NA,5
"Simoncini, M. S., Leiva, P. M. L., Piña, C. I., & Cruz, F. B. (2019). Influence of temperature variation on incubation period, hatching success, sex ratio, and phenotypes in Caiman latirostris. Journal of Experimental Zoology Part A, 331(5), 299-307.",NA,Crocodilian,NA,1
"Singh, S. K., Das, D., & Rhen, T. (2020). Embryonic temperature programs phenotype in reptiles. Frontiers in Physiology, 11, 35.",NA,No new data,NA,1
"Smith, C. A., & Joss, J. M. P. (1993). Gonadal sex differentiation in Alligator mississippiensis, a species with temperature-dependent sex determination. Cell and Tissue Research, 273(1), 149-162.",NA,Crocodilian,NA,3
"Smith, C. A., & Joss, J. M. P. (1994). Sertoli cell differentiation and gonadogenesis in Alligator mississippiensis. Journal of Experimental Zoology, 270(1), 57-70.",NA,Crocodilian,NA,3
"Smith, C. A., & Joss, J. M. P. (1994). Steroidogenic enzyme activity and ovarian differentiation in the saltwater crocodile, Crocodylus porosus. General and Comparative Endocrinology, 93(2), 232-245.",NA,Crocodilian,NA,2
"Smith, C. A., & Joss, J. M. P. (1994). Uptake of 3H-estradiol by embryonic crocodile gonads during the period of sexual differentiation. Journal of Experimental Zoology, 270(2), 219-224.",NA,Crocodilian,NA,1
"Smith, C. A., Andrews, J. E., & Sinclair, A. H. (1997). Gonadal sex differentiation in chicken embryos: Expression of estrogen receptor and aromatase genes. The Journal of Steroid Biochemistry and Molecular Biology, 60(5-6), 295-302.",NA,Bird,NA,1
"Smith, C. A., Elf, P. K., Lang, J. W., & Joss, J. M. P. (1995). Aromatase enzyme activity during gonadal sex differentiation in alligator embryos. Differentiation, 58(4), 281-290.",NA,Crocodilian,NA,1
"Smith, C. A., Shoemaker, C. M., Roeszler, K. N., Queen, J., Crews, D., & Sinclair, A. H. (2008). Cloning and expression of R-Spondin1 in different vertebrates suggests a conserved role in ovarian development. BMC Developmental Biology, 8(1), 72.",NA,No hatchling sex ratio data,NA,2
"Somaweera, R., & Shine, R. (2013). Nest-site selection by crocodiles at a rocky site in the Australian tropics: Making the best of a bad lot. Austral Ecology, 38(3), 313-325.",NA,Crocodilian,NA,1
"Sönmez, B. (2018). Relationship between metabolic heating and nest parameters in green turtles (Chelonia mydas, L. 1758) on Samandağ Beach, Turkey. Zoological Science, 35(3), 243-248.",NA,Estimated hatchling sex ratios with temperature data,NA,3
"Spanier, M. J. (2010). Beach erosion and nest site selection by the leatherback sea turtle Dermochelys coriacea (Testudines: Dermochelyidae) and implications for management practices at Playa Gandoca, Costa Rica. Revista de Biología Tropical, 58(4), 1237-1246.",NA,No hatchling sex ratio data,NA,2
"Spencer, R.-J. (2002). Experimentally testing nest site selection: Fitness trade-offs and predation risk in turtles. Ecology, 83(8), 2136-2144.",NA,No hatchling sex ratio data,NA,2
"Spencer, R.-J., & Janzen, F. J. (2014). A novel hypothesis for the adaptive maintenance of environmental sex determination in a turtle. Proceedings of the Royal Society B, 281(1789), 20140831.",NA,Estimated hatchling sex ratios with temperature data,NA,3
"Spencer, R.-J., & Thompson, M. B. (2003). The significance of predation in nest site selection of turtles: an experimental consideration of macro- and microhabitat preferences. Oikos, 102(3), 592-600.",NA,No hatchling sex ratio data,NA,5
"Spencer, R.-J., Janzen, F. J., & Thompson, M. B. (2006). Counterintuitive density-dependent growth in a long-lived vertebrate after removal of nest predators. Ecology, 87(12), 3109-3118.",NA,No hatchling sex ratio data,May have sexed offspring once secondary sexual characteristics appeared - after study,2
"Spiteri, I. D., Guillette, L. J., Jr., & Crain, D. A. (1999). The functional and structural observations of the neonatal reproductive system of alligators exposed in ovo to atrazine, 2, 4-D, or estradiol. Toxicology and Industrial Health, 15(1-2), 181-186.",NA,Crocodilian,NA,1
"Spotila, L. D., & Hall, S. E. (1998). Expression of a new RNA-splice isoform of WT1 in developing kidney–gonadal complexes of the turtle, Trachemys scripta. Comparative Biochemistry and Physiology Part B, 119(4), 761-767.",NA,No hatchling sex ratio data,NA,2
"Spotila, L. D., Spotila, J. R., & Hall, S. E. (1998). Sequence and expression analysis of WT1 and Sox9 in the red-eared slider turtle, Trachemys scripta. Journal of Experimental Zoology, 281(5), 417-427.",NA,No hatchling sex ratio data,NA,2
"St. Juliana, J. R., & Janzen, F. J. (2001). Behavioral and physiological maternal effects and temperature-dependent sex determination in common snapping turtles. American Zoologist, 41(6), 1594-1595.",NA,No hatchling sex ratio data,NA,2
"St. Juliana, J. R., & Janzen, F. J. (2007). Can natural phenotypic variances be estimated reliably under homogeneous laboratory conditions? Journal of Evolutionary Biology, 20(4), 1406-1414.",NA,No hatchling sex ratio data,NA,2
"St. Clair, R., Gregory, P. T., & Macartney, J. M. (1994). How do sexual differences in growth and maturation interact to determine size in northern and southern painted turtles? Canadian Journal of Zoology, 72(8), 1436-1443.",NA,No hatchling sex ratio data,NA,2
"Staines, M. N., Booth, D. T., & Limpus, C. J. (2019). Microclimatic effects on the incubation success, hatchling morphology and locomotor performance of marine turtles. Acta Oecologica, 97, 49-56.",NA,No hatchling sex ratio data,NA,3
"Staines, M. N., Booth, D. T., Madden Hof, C. A., & Hays, G. C. (2020). Impact of heavy rainfall events and shading on the temperature of sea turtle nests. Marine Biology, 167(12), 190.",NA,No hatchling sex ratio data,NA,4
"Steele, A. L., Wibbels, T., & Warner, D. A. (2018). Revisiting the first report of temperature-dependent sex determination in a vertebrate, the African redhead agama. Journal of Zoology, 306(1), 16-22.",NA,Squamate,NA,1
"Stewart, K. R., & Dutton, P. H. (2014). Breeding sex ratios in adult leatherback turtles (Dermochelys coriacea) may compensate for female-biased hatchling sex ratios. PLoS One, 9(2), e88138.",NA,No hatchling sex ratio data,NA,2
"Steyermark, A. C., & Spotila, J. R. (2000). Effects of maternal identity and incubation temperature on snapping turtle (Chelydra serpentina) metabolism. Physiological and Biochemical Zoology, 73(3), 298-306.",NA,No hatchling sex ratio data,NA,2
"Steyermark, A. C., & Spotila, J. R. (2001). Effects of maternal identity and incubation temperature on hatching and hatchling morphology in snapping turtles, Chelydra serpentina. Copeia, 2001(1), 129-135.",NA,No hatchling sex ratio data,NA,2
"Steyermark, A. C., & Spotila, J. R. (2001). Effects of maternal identity and incubation temperature on snapping turtle (Chelydra serpentina) growth. Functional Ecology, 15(5), 624-632.",NA,No hatchling sex ratio data,NA,2
"Stoker, C., Rey, F., Rodriguez, H., Ramos, J. G., Sirosky, P., Larriera, A., Luque, E. H., & Muñoz-de-Toro, M. (2003). Sex reversal effects on Caiman latirostris exposed to environmentally relevant doses of the xenoestrogen bisphenol A. General and Comparative Endocrinology, 133(3), 287-296.",NA,Crocodilian,NA,1
"Summers, T. M., Martin, S. L., Hapdei, J. R., Ruak, J. K., & Jones, T. T. (2018). Endangered green turtles (Chelonia mydas) of the Northern Mariana Islands: Nesting ecology, poaching, and climate concerns. Frontiers in Marine Science, 4, 428.",NA,No hatchling sex ratio data,NA,2
"Sura, P., & Jablonski, A. (1995). Sex determination in turtles. Przegląd Zoologiczny, 39(3-4), 253-263.","Sura, P., & Jablonski, A. (1995). Determinacja plci u zolwi. Przegląd Zoologiczny, 39(3-4), 253-263.",No access,NA,2
"Takada, S., DiNapoli, L., Capel, B., & Koopman, P. (2004). Sox8 is expressed at similar levels in gonads of both sexes during the sex determining period in turtles. Developmental Dynamics, 231(2), 387-395.",NA,No hatchling sex ratio data,NA,2
"Takeshita, S., Matsuda, N., Kodama, S., Suzuki, K., & Watanabe, M. (2013). In vitro thermal effects on embryonic cells of endangered hawksbill turtle Eretmochelys imbricata. Zoological Science, 30(12), 1038-1043.",NA,No hatchling sex ratio data,NA,4
"Tamplin, J. W., & Cyr, A. B. (2011). Effects of acclimation and egg-incubation temperature on selected temperature by hatchling western painted turtles (Chrysemys picta bellii). Journal of Thermal Biology, 36(8), 507-514.",NA,No hatchling sex ratio data,Assumed FPT/MPT produced all one sex,3
"Tanabe, L. K., Ellis, J., Elsadek, I., & Berumen, M. L. (2020). Potential feminization of Red Sea turtle hatchlings as indicated by in situ sand temperature profiles. Conservation Science and Practice, 2(10), e266.",NA,Estimated hatchling sex ratios with temperature data,NA,3
"Tang, W.-Q., Mu, Y., Valenzuela, N., & Du, W.-G. (2017). Effects of incubation temperature on the expression of sex-related genes in the Chinese pond turtle, Mauremys reevesii. Sexual Development, 11(5-6), 307-319.",NA,No hatchling sex ratio data,NA,4
"Tanner, C. E., Marco, A., Martins, S., Abella-Perez, E., & Hawkes, L. A. (2019). Highly feminised sex-ratio estimations for the world’s third-largest nesting aggregation of loggerhead sea turtles. Marine Ecology Progress Series, 621, 209-219.",NA,Estimated hatchling sex ratios with temperature data,NA,2
"Tapilatu, R. F., & Ballamu, F. (2015). Nest temperatures of the Piai and Sayang Islands green turtle (Chelonia mydas) rookeries, Raja Ampat Papua, Indonesia: Implications for hatchling sex ratios. Biodiversitas, 16(1), 102-107.",NA,Estimated hatchling sex ratios with temperature data,NA,2
"Tapilatu, R. F., Wona, H., Siburian, R. H., & Saleda, S. T. (2020). Heavy metals contaminants in the eggs and temperatures of nesting beaches of sea turtles in Kaimana, West Papua, Indonesia. Biodiversitas, 21(10), 4582-4590.",NA,Estimated hatchling sex ratios with temperature data,NA,3
"Tedeschi, J. N., Kennington, W. J., Berry, O., Whiting, S., Meekan, M., & Mitchell, N. J. (2015). Increased expression of Hsp70 and Hsp90 mRNA as biomarkers of thermal stress in loggerhead turtle embryos (Caretta Caretta). Journal of Thermal Biology, 47, 42-50.",NA,No new data,NA,2
"Telemeco, R. S., Abbott, K. C., & Janzen, F. J. (2013). Modeling the effects of climate change–induced shifts in reproductive phenology on temperature-dependent traits. The American Naturalist, 181(5), 637-648.",NA,No hatchling sex ratio data,NA,2
"Telemeco, R. S., Elphick, M. J., & Shine, R. (2009). Nesting lizards (Bassiana duperreyi) compensate partly, but not completely, for climate change. Ecology, 90(1), 17-22.",NA,Squamate,NA,1
"Tezak, B. M., Sifuentes-Romero, I., & Wyneken, J. (2018). A new approach for measuring temperature inside turtle eggs. Journal of Experimental Biology, 221(20), 188698.",NA,No hatchling sex ratio data,NA,2
"Tezak, B., & Wyneken, J. (2015). A novel approach to identify the sex of marine turtles. The FASEB Journal, 29(S1), 874-3.",NA,No hatchling sex ratio data,NA,4
"Therrien, C. & Wibbels, T. (2009). Effect of incubation temperature on the morphology and endocrinology of the reproductive tract of a turtle with temperature-dependent sex determination. Integrative and Comparative Biology, 49(S1), E315.",NA,No hatchling sex ratio data,NA,2
"Thomas, E. O., Light, P., Wibbels, T., & Crews, D. (1992). Hydroxysteroid dehydrogenase activity associated with sexual differentiation in embryos of the turtle Trachemys scripta. Biology of Reproduction, 46(1), 140-145.",NA,No hatchling sex ratio data,NA,4
"Thompson, D. M., Fillmore, R., Fillmore, B. M., Graves, K. G., & Ligon, D. B. (2019). Reproductive investment patterns in a captive population of alligator snapping turtles (Macrochelys temminckii). Herpetologica, 75(4), 280-289.",NA,No hatchling sex ratio data,NA,4
"Thompson, M., Coe, B. H., Andrews, R. M., Cristol, D. A., Crossley, D. A., II, & Hopkins, W. A. (2018). Agricultural land use creates evolutionary traps for nesting turtles and is exacerbated by mercury pollution. Journal of Experimental Zoology Part A, 329(4-5), 230-243.",NA,No hatchling sex ratio data,NA,3
"Torres Maldonado, L. C., Landa Piedra, A., Moreno Mendoza, N., Marmolejo Valencia, A., Meza Martínez, A., & Merchant Larios, H. (2002). Expression profiles of Dax1, Dmrt1, and Sox9 during temperature sex determination in gonads of the sea turtle Lepidochelys olivacea. General and Comparative Endocrinology, 129(1), 20-26.",NA,No hatchling sex ratio data,NA,2
"Tousignant, A., & Crews, D. (1994). Effect of exogenous estradiol applied at different embryonic stages on sex determination, growth, and mortality in the leopard gecko (Eublepharis macularius). Journal of Experimental Zoology, 268(1), 17-21.",NA,Squamate,NA,1
"Tousignant, A., & Crews, D. (1995). Incubation temperature and gonadal sex affect growth and physiology in the leopard gecko (Eublepharis macularius), a lizard with temperature-dependent sex determination. Journal of Morphology, 224(2), 159-170.",NA,Squamate,NA,1
"Treidel, L. A., Carter, A. W., & Bowden, R. M. (2016). Temperature experienced during incubation affects antioxidant capacity but not oxidative damage in hatchling red-eared slider turtles (Trachemys scripta elegans). Journal of Experimental Biology, 219(4), 561-570.",NA,No hatchling sex ratio data,NA,2
"Tucker, C. R., Strickland, J. T., Delaney, D. K., & Ligon, D. B. (2017). Thermal consequences of subterranean nesting behavior in a prairie-dwelling turtle, the Ornate Box Turtle (Terrapene ornata). Canadian Journal of Zoology, 95(2), 123-131.",NA,No hatchling sex ratio data,NA,6
"Tuttle, J., & Rostal, D. (2010). Effects of nest relocation on nest temperature and embryonic development of loggerhead sea turtles (Caretta caretta). Chelonian Conservation and Biology, 9(1), 1-7.",NA,No hatchling sex ratio data,Suggest an overall female bias based on temperature data,2
"Uchida, I. (1983). Manual for the marine chelonology - 5. Problems on eggs. Aquabiology (Tokyo), 5(6), 416-421.",NA,No access,NA,1
"Usategui-Martín, A., Liria-Loza, A., Miller, J. D., Medina-Suárez, M., Jiménez-Bordón, S., Pérez-Mellado, V., & Montero, D. (2019). Effects of incubation temperature on hatchling performance and phenotype in loggerhead sea turtle Caretta caretta. Endangered Species Research, 38, 45-53.",NA,No hatchling sex ratio data,NA,3
"Vaillant, S., Dorizzi, M., Pieau, C., & Richard-Mercier, N. (2001). Sex reversal and aromatase in chicken. Journal of Experimental Zoology, 290(7), 727-740.",NA,Bird,NA,1
"Valenzuela, N. (2001). Maternal effects on life-history traits in the Amazonian giant river turtle Podocnemis expansa. Journal of Herpetology, 35(3), 368-378.",NA,No hatchling sex ratio data,NA,2
"Valenzuela, N. (2009). The painted turtle, Chrysemys picta: A model system for vertebrate evolution, ecology, and human health. Cold Spring Harbor Protocols, 4(7),  doi:10.1101/pdb.emo124.",NA,No new data,NA,3
"Valenzuela, N. (2010). Multivariate expression analysis of the gene network underlying sexual development in turtle embryos with temperature-dependent and genotypic sex determination. Sexual Development, 4(1-2), 39-49.",NA,No hatchling sex ratio data,NA,6
"Valenzuela, N., & Shikano, T. (2007). Embryological ontogeny of aromatase gene expression in Chrysemys picta and Apalone mutica turtles: Comparative patterns within and across temperature-dependent and genotypic sex-determining mechanisms. Development Genes and Evolution, 217(1), 55-62.",NA,No hatchling sex ratio data,NA,3
"Valenzuela, N., Botero, R., & Martinez, E. (1995). A preliminary model of sex determination in Podocnemis expansa from Colombian Amazonia. International Congress of Chelonian Conservation. France - Gonfaron - Tortoise Village - 6th to 10th of July 1995. Proceedings",NA,No access,Likely data already included in database,1
"Valenzuela, N., LeClere, A., & Shikano, T. (2006). Comparative gene expression of steroidogenic factor 1 in Chrysemys picta and Apalone mutica turtles with temperature-dependent and genotypic sex determination. Evolution & Development, 8(5), 424-432.",NA,No hatchling sex ratio data,NA,4
"Valleley, E. M. A., Cartwright, E. J., Croft, N. J., Markham, A. F., & Coletta, P. L. (2001). Characterisation and expression of Sox9 in the leopard gecko, Eublepharis macularius. Journal of Experimental Zoology, 291(1), 85-91.",NA,Squamate,NA,1
"Verma, N., Verma, B. K., & Pushpavanam, S. (2020). Modeling temperature-dependent sex determination in oviparous species using a dynamical systems approach. Bulletin of Mathematical Biology, 82(7), 89.",NA,No new data,NA,3
"Viets, B. E., Ewert, M. A., Talent, L. G., & Nelson, C. E. (1994). Sex-determining mechanisms in squamate reptiles. Journal of Experimental Zoology, 270(1), 45-56.",NA,Squamate,NA,1
"Viets, B. E., Tousignant, A., Ewert, M. A., Nelson, C. E., & Crews, D. (1993). Temperature-dependent sex determination in the leopard gecko, Eublepharis macularius. Journal of Experimental Zoology, 265(6), 679-683.",NA,Squamate,NA,1
"Vindas-Picado, J., Yaney-Keller, A., St. Andrews, L., Panagopoulou, A., & Santidrián Tomillo, P. (2020). Effectiveness of shading to mitigate the impact of high temperature on sea turtle clutches considering the effect on primary sex ratios. Mitigation and Adaptation Strategies for Global Change, 25(8), 1509-1521.",NA,Estimated hatchling sex ratios with temperature data,NA,3
"Vogt, R. C. (1994). Temperature controlled sex determination as a tool for turtle conservation. Chelonian Conservation and Biology, 1(2), 159-162.",NA,No new data,NA,1
"Vogt, R. C., & Bull, J. J. (1982). Temperature controlled sex-determination in turtles: Ecological and behavioral aspects. Herpetologica, 38(1), 156-164.",NA,No new data,NA,3
"Vogt, R. C., & Flores-Villela, O. A. (1986). Determinacion del sexo en tortugas por la temperatura de incubacion de los huevos. Ciencia, 37, 21-32.",NA,No new data,NA,1
"Wallace, B. P., Sotherland, P. R., Spotila, J. R., Reina, R. D., Franks, B. F., & Paladino, F. V. (2004). Biotic and abiotic factors affect the nest environment of embryonic leatherback turtles, Dermochelys coriacea. Physiological and Biochemical Zoology, 77(3), 423-432.",NA,No hatchling sex ratio data,NA,4
"Wang, J., Hua, L., & Ru, W. (2019). Identification and characterization of miRNAs in temperature-dependent sex determination (TSD) of Chinese pond turtles (Mauremys reevesii). Gene Expression Omnibus, http://www.ncbi.nlm.nih.gov/geo/query/acc.cgi?acc=GSE92957.",NA,No hatchling sex ratio data,miRNA associated with an unpublished (?) paper that likely contains sex ratio data,2
"Warner, D. A. (2011). Sex determination in reptiles. In D. Norris & K. H. Lopez (Eds.), Hormones and reproduction of vertebrates, volume 3: Reptiles (pp. 1-38). Academic Press, Cambridge, Massachusetts.",NA,No new data,NA,3
"Warner, D. A., & Shine, R. (2005). The adaptive significance of temperature-dependent sex determination: Experimental tests with a short-lived lizard. Evolution, 59(10), 2209-2221.",NA,Squamate,NA,1
"Warner, D. A., & Shine, R. (2007). Fitness of juvenile lizards depends on seasonal timing of hatching, not offspring body size. Oecologia, 154(1), 65-73.",NA,Squamate,NA,1
"Warner, D. A., & Shine, R. (2011). Interactions among thermal parameters determine offspring sex under temperature-dependent sex determination. Proceedings of the Royal Society B, 278(1703), 256-265.",NA,Squamate,NA,2
"Warner, D. A., Jorgensen, C. F., & Janzen, F. J. (2010). Maternal and abiotic effects on egg mortality and hatchling size of turtles: Temporal variation in selection over seven years. Functional Ecology, 24(4), 857-866.",NA,No hatchling sex ratio data,NA,3
"Warner, D. A., Moody, M. A., Telemeco, R. S., & Kolbe, J. J. (2012). Egg environments have large effects on embryonic development, but have minimal consequences for hatchling phenotypes in an invasive lizard. Biological Journal of the Linnean Society, 105(1), 25-41.",NA,Squamate,NA,1
"Webb, J. K., Brown, G. P., & Shine, R. (2001). Body size, locomotor speed and antipredator behaviour in a tropical snake (Tropidonophis mairii, Colubridae): The influence of incubation environments and genetic factors. Functional Ecology, 15(5), 561-568.",NA,Squamate,NA,1
"Western, P. S., & Sinclair, A. H. (2001). Sex, genes, and heat: Triggers of diversity. Journal of Experimental Zoology, 290(6), 624-631.",NA,No hatchling sex ratio data,NA,1
"While, G. M., Noble, D. W. A., Uller, T., Warner, D. A., Riley, J. L., Du, W.-G., & Schwanz, L. E. (2018). Patterns of developmental plasticity in response to incubation temperature in reptiles. Journal of Experimental Zoology Part A, 329(4-5), 162-176.",NA,No hatchling sex ratio data,NA,1
"White, R. B., & Thomas, P. (1992). Adrenal-kidney and gonadal steroidogenesis during sexual differentiation of a reptile with temperature-dependent sex determination. General and Comparative Endocrinology, 88(1), 10-19.",NA,No hatchling sex ratio data,NA,2
"White, R. B., & Thomas, P. (1992). Stimulation of in vitro steroidogenesis by pituitary hormones in a turtle (Trachemys scripta) within the temperature-sensitive period for sex determination. Biology of Reproduction, 47(6), 952-959.",NA,No hatchling sex ratio data,Assumed FPT/MPT produced all one sex,3
"White, R. B., & Thomas, P. (1992). Whole-body and plasma concentrations of steroids in the turtle, Trachemys scripta, before, during, and after the temperature-sensitive period for sex determination. Journal of Experimental Zoology, 264(2), 159-166.",NA,No hatchling sex ratio data,NA,2
"Wibbels, T., & Murdock, C. (2000). Interclutch variability of sex ratios produced at pivotal temperature in a turtle with temperature-dependent sex determination. American Zoologist, 40(6), 1258.",NA,No new data,NA,2
"Wibbels, T., Bull, J. J., & Crews, D. (1994). Temperature-dependent sex determination: A mechanistic approach. Journal of Experimental Zoology, 270(1), 71-78.",NA,No new data,NA,4
"Wibbels, T., Cowan, J., & LeBoeuf, R. (1998). Temperature-dependent sex determination in the red-eared slider turtle, Trachemys scripta. Journal of Experimental Zoology, 281(5), 409-416.",NA,No new data,NA,2
"Wibbels, T., Mackey, W. R., Hillis-Starr, Z.-M., & Phillips, B. (1999). Hurricanes and hatchling hawksbill sea turtle sex ratios. American Zoologist, 39(5), 27A.",NA,No hatchling sex ratio data,NA,1
