Reference,Reference_Alternative,Reason_for_Exclusion,Notes,Occurrences
"Abreu-Grobois, F. A., Morales-Mérida, B. A., Hart, C. E., Guillon, J. M., Godfrey, M. H., Navarro, E., & Girondot, M. (2020). Recent advances on the estimation of the thermal reaction norm for sex ratios. PeerJ, 8, e8451.",NA,No new data,NA,4
"Ackerman, R. A. (1994). Temperature, time, and reptile egg water exchange. Israel Journal of Ecology and Evolution, 40(3-4), 293-306.",NA,No hatchling sex ratio data,NA,3
"Allen, C. D., Robbins, M. N., Eguchi, T., Owens, D. W., Meylan, A. B., Meylan, P. A., Kellar, N. M., Schwenter, J. A., Nollens, H. H., LeRoux, R. A., Dutton, P. H., & Seminoff, J. A. (2015). First assessment of the sex ratio for an East Pacific green sea turtle foraging aggregation: Validation and application of a testosterone ELISA. PLoS One, 10(10), e0138861.",NA,No hatchling sex ratio data,NA,3
"Allsteadt, J., & Lang, J. W. (1995). Incubation temperature affects body size and energy reserves of hatchling American alligators (Alligator mississippiensis). Physiological Zoology, 68(1), 76-97.",NA,Crocodilian,NA,2
"Andrewartha, S. J., Mitchell, N. J., & Frappell, P. B. (2010). Does incubation temperature fluctuation influence hatchling phenotypes in reptiles? A test using parthenogenetic geckos. Physiological and Biochemical Zoology, 83(4), 597-607.",NA,Squamate,NA,1
"Angilletta, M. J., Jr., Winters, R. S., & Dunham, A. E. (2000). Thermal effects on the energetics of lizard embryos: Implications for hatchling phenotypes. Ecology, 81(11), 2957-2968.",NA,Squamate,NA,1
"Ávila-Aguilar, A. (2015). Nest-site selection of Lepidochelys olivacea (Testudines: Cheloniidae) in the South Pacific region of Costa Rica. Revista de Biología Tropical, 63(S1), 375-381.","Ávila-Aguilar, A. (2015). Selección de sitios de anidación de Lepidochelys olivacea (Testudines: Cheloniidae) en el Pacífico Sur de Costa Rica. Revista de Biología Tropical, 63(S1), 375-381.",No hatchling sex ratio data,NA,5
"Azanza-Ricardo, J., Ibarra Martín, M. E., González Sansón, G., Harrison, E., Medina Cruz, Y., & Bretos, F. (2017). Possible effect of global climate change on Caretta caretta (Testudines, Cheloniidae) nesting ecology at Guanahacabibes Peninsula, Cuba. Chelonian Conservation and Biology, 16(1), 12-19.",NA,No hatchling sex ratio data,NA,2
"Barlian, A., Vanawati, N., & Ayuningtyas, F. D. (2015). The patterns of sex determination and differentiation genes in green sea turtle (Chelonia mydas). Journal of Biological Researches, 20, 15-20.",NA,No hatchling sex ratio data,NA,2
"Beckwith, V. K., & Fuentes, M. M. P. B. (2018). Microplastic at nesting grounds used by the northern Gulf of Mexico loggerhead recovery unit. Marine Pollution Bulletin, 131, 32-37.",NA,No hatchling sex ratio data,NA,2
"Beggs, K., Young, J., Georges, A., & West, P. (2000). Ageing the eggs and embryos of the pig-nosed turtle, Carettochelys insculpta (Chelonia: Carettochelydidae), from northern Australia. Canadian Journal of Zoology, 78(3), 373-392.",NA,No hatchling sex ratio data,NA,4
"Belaïd, B., Cong, H. N., Devilliers, G., Richard-Mercier, N., Pieau, C., & Dorizzi, M. (2004). Lymphoid aggregates in gonads of embryos, hatchlings, and young of turtles with temperature-dependent sex determination. Journal of Experimental Zoology Part A, 301(2), 160-168.",NA,No new data,NA,4
"Bergeron, J. M., Gahr, M., Horan, K., Wibbels, T., & Crews, D. (1998). Cloning and in situ hybridization analysis of estrogen receptor in the developing gonad of the red-eared slider turtle, a species with temperature-dependent sex determination. Development, Growth & Differentiation, 40(2), 243-254.",NA,No hatchling sex ratio data,"Fig. 7 caption suggests individuals were sexed, but numbers not provided",2
"Besson, A. A., Nelson, N. J., Nottingham, C. M., & Cree, A. (2012). Is cool egg incubation temperature a limiting factor for the translocation of tuatara to southern New Zealand? New Zealand Journal of Ecology, 36(1), 90-99.",NA,Tuatara,NA,2
"Bevan, E. M., Wibbels, T., Shaver, D., Shelby Walker, J., Illescas, F., Montano, J., Ortiz, J., Peña, J. J., Sarti, L., Najera, B. M. Z., & Burchfield, P. (2019). Comparison of beach temperatures in the nesting range of Kemp’s ridley sea turtles in the Gulf of Mexico, Mexico and USA. Endangered Species Research, 40, 31-40.",NA,No hatchling sex ratio data,NA,2
"Bieser, K. L., Wibbels, T., Mourad, G., & Paladino, F. (2013). The cloning and expression analysis of Lhx9 during gonadal sex differentiation in the red-eared slider turtle, Trachemys scripta, a species with temperature-dependent sex determination. Journal of Experimental Zoology Part B, 320(4), 238-246.",NA,No hatchling sex ratio data,"Sex reversal verified by histology of stage 26 embryos, but numbers not provided",3
"Bladow, R. A., & Milton, S. L. (2019). Embryonic mortality in green (Chelonia mydas) and loggerhead (Caretta caretta) sea turtle nests increases with cumulative exposure to elevated temperatures. Journal of Experimental Marine Biology and Ecology, 518, 151180.",NA,No hatchling sex ratio data,NA,4
"Blamires, S. J., & Guinea, M. L. (2003). Emergence success of flatback sea turtles (Natator depressus) at Fog Bay, Northern Territory, Australia. Chelonian Conservation and Biology, 4(3), 548-556.",NA,Estimated hatchling sex ratios with temperature data,NA,2
"Blanvillain, G., Wood, L. D., Meylan, A. B., & Meylan, P. A. (2007). Sex ratio prediction of juvenile hawksbill sea turtles (Eretmochelys imbricata) from south Florida, USA. Herpetological Conservation and Biology, 3(1), 21-27.",NA,No hatchling sex ratio data,NA,2
"Bock, B. C., Páez, V. P., & Daza, J. M. (2010). Trachemys callirostris (Gray 1856) - Colombian slider, jicotea, hicotea, galapago, morrocoy de agua. In A. G. J. Rhodin, P. C. H. Pritchard, P. P. van Dijk, R. A. Saumure, K. A. Buhlmann, J. B. Iverson, & R. A. Mittermeier (Eds.), Conservation biology of freshwater turtles and tortoises: A compilation project of the IUCN/SSC Tortoise and Freshwater Turtle Specialist Group. Chelonian Research Monographs, 5, 42.1-42.9.",NA,No new data,NA,6
"Bodensteiner, B. L., Warner, D. A., Iverson, J. B., Milne-Zelman, C. L., Mitchell, T. S., Refsnider, J. M., & Janzen, F. J. (2019). Geographic variation in thermal sensitivity of early life traits in a widespread reptile. Ecology and Evolution, 9(5), 2791-2802.",NA,No hatchling sex ratio data,NA,2
"Bolton, R. M., & Brooks, R. J. (2010). Impact of the seasonal invasion of Phragmites australis (common reed) on turtle reproductive success. Chelonian Conservation and Biology, 9(2), 238-243.",NA,No hatchling sex ratio data,NA,4
"Bonach, K., Piña, C. I., & Verdade, L. M. (2006). Allometry of reproduction of Podocnemis expansa in Southern Amazon basin. Amphibia-Reptilia, 27(1), 55-61.",NA,No hatchling sex ratio data,NA,2
"Booth, D. T. (2002). Incubation of rigid-shelled turtle eggs: Do hydric conditions matter? Journal of Comparative Physiology B, 172(7), 627-633.",NA,No hatchling sex ratio data,NA,4
"Booth, D. T. (1998). Effects of incubation temperature on the energetics of embryonic development and hatchling morphology in the Brisbane river turtle Emydura signata. Journal of Comparative Physiology B, 168(5), 399-404.",NA,No hatchling sex ratio data,NA,2
"Booth, D. T. (1998). Nest temperature and respiratory gases during natural incubation in the broad-shelled river turtle, Chelodina expansa (Testudinata: Chelidae). Australian Journal of Zoology, 46(2), 183-191.",NA,No hatchling sex ratio data,NA,3
"Booth, D. T. (2000). Incubation of eggs of the Australian broad-shelled turtle, Chelodina expansa (Testudinata: Chelidae), at different temperatures: Effects on pattern of oxygen consumption and hatchling morphology. Australian Journal of Zoology, 48(4), 369-378.",NA,No hatchling sex ratio data,NA,3
"Booth, D. T. (2006). Influence of incubation temperature on hatchling phenotype in reptiles. Physiological and Biochemical Zoology, 79(2), 274-281.",NA,No hatchling sex ratio data,NA,4
"Booth, D. T. (2018). Incubation temperature induced phenotypic plasticity in oviparous reptiles: Where to next? Journal of Experimental Zoology Part A, 329(6-7), 343-350.",NA,No hatchling sex ratio data,NA,4
"Booth, D. T., & Astill, K. (2001). Incubation temperature, energy expenditure and hatchling size in the green turtle (Chelonia mydas), a species with temperature-sensitive sex determination. Australian Journal of Zoology, 49(4), 389-396.",NA,No hatchling sex ratio data,NA,3
"Booth, D. T., & Astill, K. (2001). Temperature variation within and between nests of the green sea turtle, Chelonia mydas (Chelonia: Cheloniidae) on Heron Island, Great Barrier Reef. Australian Journal of Zoology, 49(1), 71-84.",NA,Estimated hatchling sex ratios with temperature data,NA,2
"Booth, D. T., & Freeman, C. (2006). Sand and nest temperatures and an estimate of hatchling sex ratio from the Heron Island green turtle (Chelonia mydas) rookery, Southern Great Barrier Reef. Coral Reefs, 25(4), 629-633.",NA,Estimated hatchling sex ratios with temperature data,NA,2
"Bowden, R. M., & Paitz, R. T. (2018). Temperature fluctuations and maternal estrogens as critical factors for understanding temperature-dependent sex determination in nature. Journal of Experimental Zoology Part A, 329(4-5), 177-184.",NA,No new data,NA,1
"Bowden, R. M., Paitz, R. T., & Janzen, F. J. (2011). The ontogeny of postmaturation resource allocation in turtles. Physiological and Biochemical Zoology, 84(2), 204-211.",NA,No hatchling sex ratio data,NA,2
"Boyle, M., Hone, J., Schwanz, L. E., & Georges, A. (2014). Under what conditions do climate-driven sex ratios enhance versus diminish population persistence? Ecology and Evolution, 4(23), 4522-4533.",NA,No hatchling sex ratio data,NA,4
"Bragg, W. K., Fawcett, J. D., Bragg, T. B., & Viets, B. E. (2000). Nest-site selection in two eublepharid gecko species with temperature-dependent sex determination and one with genotypic sex determination. Biological Journal of the Linnean Society, 69(3), 319-332.",NA,Squamate,NA,1
"Braun-McNeill, J., Epperly, S. P., Owens, D. W., Avens, L., Williams, E., & Harms, C. A. (2007). Seasonal reliability of testosterone radioimmunoassay (RIA) for predicting sex ratios of juvenile loggerhead (Caretta caretta) turtles. Herpetologica, 63(3), 275-284.",NA,No hatchling sex ratio data,NA,2
"Breitenbach, A. T., Paitz, R. T., & Bowden, R. M. (2020). Let's do the time-lag again: Ecologically relevant incubation temperatures delay the response of sex-determining genes in a turtle with TSD. Integrative and Comparative Biology, 60(S1), E24.",NA,No hatchling sex ratio data,NA,2
"Bringsoe, H. (1996). Rodoret terrapin (Trachemys scripta elegans) - en velegnet begynderskildpadde? Nordisk Herpetologisk Forening, 39(6), 130-144.",NA,No access,NA,1
"Broderick, A. C., Godley, B. J., & Hays, G. C. (2001). Metabolic heating and the prediction of sex ratios for green turtles (Chelonia mydas). Physiological and Biochemical Zoology, 74(2), 161-170.",NA,Estimated hatchling sex ratios with temperature data,NA,4
"Bujes, C. S., & Verrastro, L. (2009). Nest temperature, incubation time, hatching, and emergence in the Hilaire's side-necked turtle (Phrynops hilarii). Herpetological Conservation and Biology, 4(3), 306-312.",NA,No hatchling sex ratio data,NA,3
"Bull, J. J. (1987). Temperature-sensitive periods of sex determination in a lizard: Similarities with turtles and crocodilians. Journal of Experimental Zoology, 241(1), 143-148.",NA,Squamate,NA,1
"Bull, J. J. (2008). Sex determination: Are two mechanisms better than one? Journal of Biosciences, 32(1), 5-8.",NA,No hatchling sex ratio data,NA,2
"Burger, J. (1991). Effects of incubation temperature on behavior of hatchling pine snakes: Implications for reptilian distribution. Behavioral Ecology and Sociobiology, 28(4), 297-303.",NA,Squamate,NA,2
"Burger, J. (1998). Effects of incubation temperature on hatchling pine snakes: Implications for survival. Behavioral Ecology and Sociobiology, 43(1), 11-18.",NA,Squamate,NA,1
"Burger, J., Gochfeld, M., Jeitner, C., Zappalorti, R., Pittfield, T., & DeVito, E. (2017). Arsenic, cadmium, chromium, lead, mercury and selenium concentrations in pine snakes (Pituophis melanoleucus) from the New Jersey pine barrens. Archives of Environmental Contamination and Toxicology, 72(4), 586-595.",NA,Squamate,NA,2
"Burke, R. L. (1993). Adaptive value of sex determination mode and hatchling sex ratio bias in reptiles. Copeia, 1993(3), 854-859.",NA,No hatchling sex ratio data,NA,1
"Caillouet, C. W., Jr., & Duronslet, M. J. (1985). Sea turtle sex ratios and incubation temperature: Are we on the right track? Marine Turtle Newsletter, 35, 14-16.",NA,No hatchling sex ratio data,NA,1
"Calderón-Peña, R., Betancourt-Avila, R., Rodríguez-Fajardo, E., Martínez-González, Y., & Azanza-Ricardo, J. (2020). Sex ratio of the green sea turtle Chelonia mydas (Testudines: Cheloniidae) hatchlings in the Guanahacabibes Peninsula, Cuba. Revista de Biología Tropical, 68(3), 777-784.",NA,Estimated hatchling sex ratios with incubation length data,NA,2
"Campos, Z. (1993). Effect of habitat on survival of eggs and sex ratio of hatchlings of Caiman crocodilus yacare in the Pantanal, Brazil. Journal of Herpetology, 27(2), 127-132.",NA,Crocodilian,NA,1
"Candan, O. & Kolankaya, D. (2014). Temperature profiles and sex ratio estimation for green turtle (Chelonia mydas) hatchlings on Sugozu Beaches. Hacettepe Journal of Biology and Chemistry, 42(4), 531-536.","Candan, O. & Kolankaya, D. (2014). Sugözü Kumsalları’ndaki̇ Sıcaklık Profilleri ve Yeşil Kaplumbağa (Chelonia mydas) Yavrularında Eşey Oranı Tahmini. Hacettepe Journal of Biology and Chemistry, 42(4), 531-536.",Estimated hatchling sex ratios with temperature data,NA,2
"Canesini, G., Stoker, C., Galoppo, G. H., Durando, M. L., Tschopp, M. V., Luque, E. H., Muñoz-de-Toro, M. M., & Ramos, J. G. (2018). Temperature- vs. estrogen-induced sex determination in Caiman latirostris embryos: Both females, but with different expression patterns of key molecules involved in ovarian development. General and Comparative Endocrinology, 259, 176-188.",NA,Crocodilian,NA,1
"Carreras, C., Pascual, M., Tomás, J., Marco, A., Hochscheid, S., Castillo, J. J., Gozalbes, P., Parga, M., Piovano, S., & Cardona, L. (2018). Sporadic nesting reveals long distance colonisation in the philopatric loggerhead sea turtle (Caretta caretta). Scientific Reports, 8(1), 1435.",NA,Estimated hatchling sex ratios with incubation length data,NA,2
"Carter, A. W., Bowden, R. M., & Paitz, R. T. (2016). Can yolk estrogens affect sex determination when incubation temperatures fluctuate in a species with TSD? Integrative and Comparative Biology, 56(S1), E31.",NA,No hatchling sex ratio data,NA,2
"Caut, S., Guirlet, E., Jouquet, P., & Girondot, M. (2006). Influence of nest location and yolkless eggs on the hatching success of leatherback turtle clutches in French Guiana. Canadian Journal of Zoology, 84(6), 908-915.",NA,No hatchling sex ratio data,NA,4
"Cavallo, C., Dempster, T., Kearney, M. R., Kelly, E., Booth, D., Hadden, K. M., & Jessop, T. S. (2015). Predicting climate warming effects on green turtle hatchling viability and dispersal performance. Functional Ecology, 29(6), 768-778.",NA,No hatchling sex ratio data,NA,4
"Charruau, P. (2012). Microclimate of American crocodile nests in Banco Chinchorro biosphere reserve, Mexico: Effect on incubation length, embryos survival and hatchlings sex. Journal of Thermal Biology, 37(1), 6-14.",NA,Crocodilian,NA,1
"Chen, Y., Zhao, B., Sun, B.-J., Wang, Y., & Du, W.-G. (2011). Between-population variation in body size and growth rate of hatchling Asian yellow pond turtles, Mauremys mutica. The Herpetological Journal, 21(2), 113-116.",NA,No hatchling sex ratio data,NA,2
"Chitty, J., & Raftery, A. (2013). Essentials of tortoise medicine and surgery. Wiley-Blackwell, Hoboken, New Jersey.",NA,No new data,NA,4
"Chojnowski, J. L., & Braun, E. L. (2009). Candidate genes in a turtle with temperature-dependent sex determination. Integrative and Comparative Biology, 49(S1), E212.",NA,No hatchling sex ratio data,NA,2
"Chu, C. T., Booth, D. T., & Limpus, C. J. (2008). Estimating the sex ratio of loggerhead turtle hatchlings at Mon Repos rookery (Australia) from nest temperatures. Australian Journal of Zoology, 56(1), 57-64.",NA,Estimated hatchling sex ratios with temperature data,NA,3
"Ciofi, C., & Swingland, I. R. (1997). Environmental sex determination in reptiles. Applied Animal Behaviour Science, 51(3-4), 251-265.",NA,No new data,NA,5
"Clusella Trullas, S., & Paladino, F. V. (2007). Micro-environment of olive ridley turtle nests deposited during an aggregated nesting event. Journal of Zoology, 272(4), 367-376.",NA,No hatchling sex ratio data,NA,6
"Colbert, P. L., Spencer, R.-J., & Janzen, F. J. (2010). Mechanism and cost of synchronous hatching. Functional Ecology, 24(1), 112-121.",NA,No hatchling sex ratio data,NA,4
"Congdon, J. D., Fischer, R. U., & Gatten, R. E., Jr. (1995). Effects of incubation temperatures on characteristics of hatchling American alligators. Herpetologica, 51(4), 497-504.",NA,Crocodilian,NA,2
"Conley, A. J., Elf, P., Corbin, C. J., Dubowsky, S., Fivizzani, A., & Lang, J. W. (1997). Yolk steroids decline during sexual differentiation in the alligator. General and Comparative Endocrinology, 107(2), 191-200.",NA,Crocodilian,NA,3
"Cook, C. E., McCluskey, A. M., & Chambers, R. M. (2018). Impacts of invasive Phragmites australis on diamondback terrapin nesting in Chesapeake Bay. Estuaries and Coasts, 41(4), 966-973.",NA,No hatchling sex ratio data,NA,1
"Cordero, G. A., Karnatz, M. L., Svendsen, J. C., & Gangloff, E. J. (2017). Effects of low-oxygen conditions on embryo growth in the painted turtle, Chrysemys picta. Integrative Zoology, 12(2), 148-156.",NA,No hatchling sex ratio data,NA,2
"Cree, A., Thompson, M. B., & Daugherty, C. H. (1995). Tuatara sex determination. Nature, 375(6532), 543.",NA,Tuatara,NA,1
"Crews, D. (1996). Temperature-dependent sex determination: The interplay of steroid hormones and temperature. Zoological Science, 13(1), 1-13.",NA,No new data,NA,2
"Crews, D. (2003). Sex determination: Where environment and genetics meet. Evolution & Development, 5(1), 50-55.",NA,No hatchling sex ratio data,NA,1
"Crews, D., Bergeron, J. M., & McLachlan, J. A. (1995). The role of estrogen in turtle sex determination and the effect of PCBs. Environmental Health Perspectives, 103, 73-77.",NA,No new data,NA,1
"Crews, D., Fleming, A., Willingham, E., Baldwin, R., & Skipper, J. K. (2001). Role of steroidogenic factor 1 and aromatase in temperature-dependent sex determination in the red-eared slider turtle. Journal of Experimental Zoology, 290(6), 597-606.",NA,No new data,NA,3
"Crews, D., Lou, W., Fleming, A., & Ogawa, S. (2006). From gene networks underlying sex determination and gonadal differentiation to the development of neural networks regulating sociosexual behavior. Brain Research, 1126(1), 109-121.",NA,No hatchling sex ratio data,NA,1
"Dang, W., Zhang, W., & Du, W.-G. (2015). Incubation temperature affects the immune function of hatchling soft-shelled turtles, Pelodiscus sinensis. Scientific Reports, 5, 10594.",NA,No hatchling sex ratio data,NA,3
"Danni, T. M. S., & Alho, C. J. R. (1985). Histological study of sexual differentiation in recently eclosed turtles Podocnemis expansa Pelomedusidae. Revista Brasileira de Biologia, 45(3), 365-368.",NA,No access,Likely data already included in database,2
"Davy, C. M., Paterson, J. E., & Leifso, A. E. (2014). When righting is wrong: Performance measures require rank repeatability for estimates of individual fitness. Animal Behaviour, 93, 15-23.",NA,No hatchling sex ratio data,Authors sexed Apalone spinifera but do not provide data,5
"de Solla, S. R., & Martin, P. A. (2011). Absorption of current use pesticides by snapping turtle (Chelydra serpentina) eggs in treated soil. Chemosphere, 85(5), 820-825.",NA,No hatchling sex ratio data,NA,2
"Deeming, D. C. (2004). Perspectives in reptilian incubation. In D. C. Deeming (Ed.), Reptilian incubation: Environment, evolution, and behaviour (pp. 265-270). Nottingham University Press, Nottingham, United Kingdom.",NA,No hatchling sex ratio data,NA,1
"DeGregorio, B. A., & Southwood Williard, A. (2011). Incubation temperatures and metabolic heating of relocated and in situ loggerhead sea turtle (Caretta caretta) nests at a northern rookery. Chelonian Conservation and Biology, 10(1), 54-61.",NA,Estimated hatchling sex ratios with temperature data,NA,3
"dei Marcovaldi, M. A. G., López-Mendilaharsu, M., Santos, A. S., Lopez, G. G., Godfrey, M. H., Tognin, F., Baptistotte, C., Thomé, J. C., Dias, A. C. C., de Castilhos, J. C., & Fuentes, M. M. P. B. (2016). Identification of loggerhead male producing beaches in the south Atlantic: Implications for conservation. Journal of Experimental Marine Biology and Ecology, 477, 14-22.",NA,Estimated hatchling sex ratios with incubation length data,NA,2
"dei Marcovaldi, M. A. G., Santos, A. J. B., Santos, A. S., Soares, L. S., Lopez, G. G., Godfrey, M. H., López-Mendilaharsu, M., & Fuentes, M. M. P. B. (2014). Spatio-temporal variation in the incubation duration and sex ratio of hawksbill hatchlings: Implication for future management. Journal of Thermal Biology, 44, 70-77.",NA,Estimated hatchling sex ratios with incubation length data,NA,2
"Delmas, V., Bonnet, X., Girondot, M., & Prévot-Julliard, A.-C. (2008). Varying hydric conditions during incubation influence egg water exchange and hatchling phenotype in the red-eared slider turtle. Physiological and Biochemical Zoology, 81(3), 345-355.",NA,No hatchling sex ratio data,NA,3
"Demas, S., Duronslet, M., Wachtel, S., Caillouet, C., & Nakamura, D. (1990). Sex-specific DNA in reptiles with temperature sex determination. Journal of Experimental Zoology, 253(3), 319-324.",NA,No hatchling sex ratio data,NA,3
"Desvages, G., & Pieau, C. (1991). Steroid metabolism in gonads of turtle embryos as a function of the incubation temperature of eggs. Journal of Steroid Biochemistry and Molecular Biology, 39(2), 203-213.",NA,No hatchling sex ratio data,NA,2
"Desvages, G., & Pieau, C. (1992). Time required for temperature-induced changes in gonadal aromatase activity and related gonadal structure in turtle embryos. Differentiation, 52(1), 13-18.",NA,No hatchling sex ratio data,NA,2
"Desvages, G., Girondot, M., & Pieau, C. (1993). Sensitive stages for the effects of temperature on gonadal aromatase activity in embryos of the marine turtle Dermochelys coriacea. General and Comparative Endocrinology, 92(1), 54-61.",NA,No hatchling sex ratio data,NA,4
"Díaz-Hernández, V., Dominguez-Mora, P., Chino-Palomo, L., Marmolejo-Valencia, A., Harfush, M., & Merchant-Larios, H. (2020). Spatiotemporal expression of Foxl2 and Dmrt1 before, during, and after sex determination in the sea turtle Lepidochelys olivacea. Sexual Development, 13(5-6), 286-296.",NA,No hatchling sex ratio data,NA,4
"Díaz-Hernández, V., Marmolejo-Valencia, A., Harfush, M., & Merchant-Larios, H. (2012). Formation of the genital ridges is preceded by a domain of ectopic Sox9-expressing cells in Lepidochelys olivacea. Developmental Biology, 361(1), 156-166.",NA,No hatchling sex ratio data,Mention 80% of stage 28 embryos were differentiated,3
"Díaz-Hernández, V., Vázquez-Gómez, A., Marmolejo-Valencia, A., Montaño, L. M., & Merchant-Larios, H. (2017). 17β-Estradiol modulates cell proliferation of medullary cords during ovarian differentiation of the Lepidochelys olivacea sea turtle. Developmental Biology, 431(2), 263-271.",NA,No hatchling sex ratio data,Gives general overview of gonads from each treatment,3
"Díaz-Paniagua, C., Andreu, A. C., & Keller, C. (2006). Effects of temperature on hatching success in field incubating nests of spur-thighed tortoises, Testudo graeca. The Herpetological Journal, 16(3), 249-257.",NA,No hatchling sex ratio data,NA,4
"Diez, C. E., & van Dam, R. P. (2003). Sex ratio of an immature hawksbill seaturtle aggregation at Mona Island, Puerto Rico. Journal of Herpetology, 37(3), 533-537.",NA,No hatchling sex ratio data,NA,2
"Dima, A. O. M., Solihin, D. D., Manalu, W., & Boediono, A. (2015). Expression profile of sex determination gene, bioreproduction, phenotype, and locomotory performances of olive ridley, Lepidochelys olivacea induced by different incubation temperature. Jurnul Ilmu dan Teknologi Kelautan Tropis, 7(1), 143-155.","Dima, A. O. M., Solihin, D. D., Manalu, W., & Boediono, A. (2015). Profil ekspresi gen determinasi seks, bioreproduksi, fenotipe, dan performa lokomotori penyu lekang (Lepidochelys olivacea) yang diinduksi pada suhu inkubasi berbeda. Jurnul Ilmu dan Teknologi Kelautan Tropis, 7(1), 143-155.",No hatchling sex ratio data,NA,2
"Dimond, M. T. (1985). Some effects of temperature on turtle egg production. In S. C. Goel & C. B. L. Srivastava (Eds.), Recent advances in developmental biology of animals (pp. 35-39). Indian Society of Developmental Biologists, Poona.",NA,No hatchling sex ratio data,NA,1
"Ding, G.-H., Yang, J., Wang, J., & Ji, X. (2012). Offspring sex in a TSD gecko correlates with an interaction between incubation temperature and yolk steroid hormones. Naturwissenschaften, 99(12), 999-1006.",NA,Squamate,NA,1
"Dodd, K. L., & Wibbels, T. (2006). Development and use of real-time PCR for examining Sox9 expression in the red-eared slider turtle. Integrative and Comparative Biology, 46(S1), E189.",NA,No hatchling sex ratio data,NA,3
